section,sent.no,filename,sentences,neutral,generalization,exemplification,attribution,conditional,ID
b,249,nlh.47.1.626116_nonotes.txt,"In the final analysis, critical disagreements are disagreements about premises, because these underlying assumptions shape all subsequent interpretive choices: the choice of my object of analysis, the research question with which I am approaching this object, and the interpretive method I will be using.",0,1,0,0,0,588
e,273,pmla.2016.131.3.686_nonotes.txt,He is reminiscent of the Stone Age–style Basap Dayaks who made possible Bernabas Sebilang’s strategic alignment with dominant discourse.,1,0,0,0,0,589
b,312,asr.2016.81.3.549_nonotes.txt,"In particular, parents likely pay special attention to the local structure of school options in terms of school district and attendance zone boundaries.",1,0,0,0,0,590
b,177,modernismmodernity.2016.23.4.833_nonotes.txt,"If Adorno then encourages us to read ""Sur l'Eau"" forwards into his later philosophy, he might also be said to restate this sentiment in his monograph on Hegel, only in reverse.",1,0,0,0,0,591
e,192,sr.55.4.04_nonotes.txt,The fact that we can read Jeanie as a madwoman may unsettle our understanding of her heroism and her right to represent Scottish virtue.,0,1,1,0,1,592
e,264,modernismmodernity.2016.23.2.365_nonotes.txt,Waves of textual apocalypse sweep away that one-sentence epitaph.,1,0,0,0,0,593
e,297,asr.2016.81.4.668_nonotes.txt,"We would stress, however, that any such future work should focus on the numerous resources associated with class origin that we cannot measure here, such as parental income and wealth, powerful social networks, elite private school or university attendance, and cultural tastes or practices with widely shared legitimacy.",1,0,0,0,0,594
b,219,modernismmodernity.2016.23.1.113_nonotes.txt,"The consultantship, or ""chair in poetry,"" as it was originally called, had been created in YEAR; in the years that followed, beginning especially with Allen Tate's term in YEAR-, it took shape as a quasi-honorific and quasi-bureaucratic job with pay but without a description.",1,0,0,0,0,595
b,303,asr.2016.81.3.447_nonotes.txt,"On the contrary, unemployment can lead to insufficient aggregate demand, which in turn depresses profits and begets failures of enterprises, generating more unemployment.",0,1,0,0,0,596
b,249,ci.43.1.688293_nonotes.txt,"In addition to everyday traffic, engineers adapt the system for special events such as a presidential visit or a blockbuster premiere.",1,0,0,0,0,598
e,234,nlh.47.4.643671_nonotes.txt,"Can we say that a taste-feeling circulates even when our preferences seem at their least emphatic, when we simply seem to be partaking in what might be considered a “period taste”?",1,0,0,0,0,599
e,216,sn.48.1.01_nonotes.txt,The position that the reader is invited to assume is hence not as innocent as we would perhaps like to believe.,0,1,0,0,0,600
b,171,sr.55.2.05_nonotes.txt,"In so doing, as this essay argues, Wordsworth was motivated by a need to assuage his growing anxiety of reception by directing his poem to that readership, ""fit though few,"" that he believed would be more receptive than past audiences had been to his work.",0,1,0,0,0,601
b,264,modernismmodernity.2016.23.2.365_nonotes.txt,"As words in advance (and often excess) of deeds, its manifestos destabilized the boundaries between ideation and realization.",0,1,0,0,0,602
b,180,modernismmodernity.2016.23.4.733_nonotes.txt,"He developed a physical culture empire of sorts; beyond his eponymous gymnasiums, he began publishing the monthly Sandow's Magazine, and he designed an extensive line of barbells, strength training apparatuses, and a cocoa ""health drink,"" all of which were emblazoned with his image.",1,0,0,0,0,603
b,222,ci.42.3.685605_nonotes.txt,"Seldom analyzed, the category of art cinema circulates, however, in writings of commentators in the mainstream media, film critics, state officials, and film studies specialists, who write as if it refers to a definite and distinct set of objects called art films.",0,1,0,0,0,604
e,174,modernismmodernity.2016.23.2.341_nonotes.txt,"The films proceed by inviting their cinematic audiences to define themselves in sharp distinction from the people-the assemblies, the crowds, the masses, also the audiences-depicted on the screen.",0,1,0,0,0,605
e,216,sn.48.1.01_nonotes.txt,The use of authorial intervention to halt the process of empathizing with one character at the expense of another indicates that there are ways to escape the paradox of empathy in literature.,0,1,0,0,0,606
e,288,asr.2016.81.5.857_nonotes.txt,"Owing to the legacy of racism in the United States, many members of the black community perceive an assault of a black man by white police officers as an assault on the black community writ large, activating a collective response.",0,1,0,0,0,607
e,180,modernismmodernity.2016.23.1.193_nonotes.txt,"As early as YEAR, he noted the role of institutionalization and historicization in producing the ""modernism"" with which artists and writers of the YEARs were wrestling.",0,1,0,1,0,608
b,312,asr.2016.81.2.316_nonotes.txt,"Cultural Framing of the Sunni Insurgency in the Context of International Law In Iraq, the legal cynicism frame involved reports of unnecessary violence by U.S. forces against Arab Sunni civilians.",1,0,0,0,0,609
e,192,sn.48.2.01_nonotes.txt,"By contrast, postmodern metafiction undermines the verisimilar posture of realism as part of a broader challenge to the referential status of nonfictional genres.",0,1,0,0,0,610
b,249,pmla.2016.131.5.1207_nonotes.txt,"By distinct, we mean not mutually intelligible with any other language.",1,0,0,0,0,611
b,186,pmla.2016.131.3.652_nonotes.txt,"Katola's doubt, in its ascribing to ""nature"" essential differences between human beings and animals, forms an analogue to categories of race by which Euro-Americans historically viewed indigenous peoples as savage, less than human.",0,1,1,0,0,612
e,165,sr.55.2.04_nonotes.txt,"Eventually a hermit takes Oswald in hand, chiding him with the words, ""Hail poverty!",1,0,0,0,0,613
b,297,asr.2016.81.5.921_nonotes.txt,The implication for research on public response to industrial projects is that politicized discourse about an industry helps redefine the perceived stakes of the issue and thereby supplements local perceptions of risk as the basis for opposition.,0,1,0,0,0,614
e,189,ci.42.2.684354_nonotes.txt,Melancholy and mystery have been central themes in the reception of these paintings since the early twentieth century.,0,1,0,0,0,616
b,231,asr.2016.81.4.749_nonotes.txt,"The kinds of jobs a man could hold for a career have diminished, and more of the remaining jobs have a temporary “stopgap” character—casual, short-term, and not part of a career strategy.",0,1,0,0,0,617
e,288,asr.2016.81.6.1097_nonotes.txt,"However, the converse could also be true.",1,0,0,0,0,618
b,324,asr.2016.81.2.396_nonotes.txt,This theory on negative information spread does not newly introduce external actors to the diffusion process.,0,1,0,0,0,619
e,183,sn.48.1.04_nonotes.txt,"By prompting disidentification with the Glasgows, along with the Benedicts, the Oakes, and the Dulaines, Ferber prompts disidentification with the ruthless monopoly capitalist in favor of the well-rounded everyday American possessed of intellectual curiosity, critical thinking skills, and a healthy life-balance of meaningful work and pleasure.",0,1,1,0,0,620
b,162,nlh.47.1.626115_nonotes.txt,"Here the interpretive crux has to do with the politically charged distinction between a “prefatory” and an “operative” clause, and with the nature of the qualification: does the initial clause (“A well regulated Militia, being necessary to the security of a free State”) merely explain the right (“because a militia is necessary …”), or does it limit it (“because and to the extent that a militia is necessary …”)?",1,0,0,0,0,621
b,219,ci.42.3.685606_nonotes.txt,I say “in the past” because the sociological surveys show us that the popularity of this activity declined from the YEARs onward.,0,1,0,0,0,622
e,339,asr.2016.81.3.488_nonotes.txt,"Second, the CCF-NDP’s claim to representing farmers and workers has often been more tenuous than that of their European counterparts.",0,1,0,0,0,623
b,261,pmla.2016.131.1.101_nonotes.txt,The analysis that follows will situate that engagement in the context of a robust discussion of memory and the unconscious that unfolded throughout the nineteenth century.,0,1,0,0,0,624
b,273,asr.2016.81.3.467_nonotes.txt,"In short, by assessing empirically the effect of corporate restructuring on these wage patterns and determinants, we can uncover evidence on the extent to which employment relationships converged to either market-based (open) contracts following the onset of corporate restructuring or instead remained ILM-based (closed).",1,0,0,0,0,625
b,198,nlh.47.1.626119_nonotes.txt,In the introduction I called “RICS” (“reading informed by cognitive science”) any interpretation of a given text/author/period that uses as ground a cognitive-scientific theory or model.,1,0,0,0,0,626
e,303,asr.2016.81.2.262_nonotes.txt,Future research should examine whether the consequences of nonstandard and mismatched employment vary with the timing of those spells in a worker’s employment trajectory.,1,0,0,0,0,628
b,279,asr.2016.81.4.828_nonotes.txt,"We naturally strive to align our interpersonal behavior with this implicit cultural knowledge, which is embedded in the affective meanings of words.",0,1,0,0,0,631
b,300,nlh.47.1.626114_nonotes.txt,"As Donald Davidson has argued, most of our beliefs about such things as trees and stars and wristwatches have to be true.",0,1,0,1,0,632
b,369,nlh.47.4.643672_nonotes.txt,"Our reading is ours not because we are autonomous when we do it, but because it remains somehow ineffable, nontransferable to others.",0,1,0,0,0,633
e,213,sn.48.3.02_nonotes.txt,"In November YEAR, for instance, she wrote to Dickens asking for his views on Stodare’s ‘Sphinx’ effect, another piece of conjuring based around decapitation, though here the head’s disjuncture from the body becomes the visible deception rather than its means.",1,0,0,0,0,634
b,189,nlh.47.4.643673_nonotes.txt,"In this case, I had assumed I would need to begin by reading as many one-day novels as possible and making observations about their characteristics and effects.",1,0,0,0,0,635
b,246,nlh.47.1.626111_nonotes.txt,A conventional literary historicism that attributes causal primacy to human culture does not always seem adequate to a new situation in which entanglements of human action with geological and climatological events are understood as motive forces of history.,0,1,0,0,0,636
b,300,pmla.2016.131.5.1256_nonotes.txt,"ON  AUGUST YEAR ELIZABETH BISHOP WROTE TO MARIANNE Moore from Brazil to announce her receipt of Moore's latest book: ""The beautiful red TOME came last Friday,"" Bishop's letter begins.",1,0,0,0,0,637
e,336,asr.2016.81.2.347_nonotes.txt,"To implement downsizing, top managers have to muddle through highly contested terrain, where investors’ interest in profit maximization collides with workers’ interest in job security; managers are often less than fully committed to pushing a plan through and may utilize the tension to maintain their decision-making autonomy, as shown in their lackluster interest in streamlining middle management positions.",0,1,0,0,0,638
e,273,pmla.2016.131.3.686_nonotes.txt,"The project is not disingenuous: Nori truly believes that the area is ""an asset that must be saved"" 'aset yang harus diselamatkan.’",1,0,0,0,0,639
e,282,nlh.47.2.631305_nonotes.txt,"They are smaller—peaks and prominences, if you like—but also more achievable, as well as dependent on a certain kind of honor.",1,0,0,0,0,640
b,177,ci.43.1.688292_nonotes.txt,"Both the satire in book  and the jarring simile in book  engage in what I will call negative prosodic cosmography; they define in verse the size and shape of the world by confirming, or confining, the limits of and to its expression.",0,1,1,0,0,641
b,237,sr.55.3.02_nonotes.txt,"Park's book is distinctive in its attention to the connection between the internal African slave trade-what the historian Walter Johnson has termed the First Passage-and the Atlantic slave trade, the notorious Middle Passage.",0,1,1,0,0,642
b,357,pmla.2016.131.1.20_nonotes.txt,"Critics have also debated the extent to which Okonkwo is or is not a ""representative figure of African historicity"".",1,0,0,0,0,643
b,288,asr.2016.81.6.1097_nonotes.txt,Prior theory and research suggest that the relationship between social class and stratification may differ for women and men.,1,0,0,0,0,644
e,288,asr.2016.81.1.107_nonotes.txt,"Third, the sampling frame for this study of non-institutionalized adults is relevant for both the independent and dependent variables considered.",1,0,0,0,0,645
e,291,ci.43.1.677294_nonotes.txt,"Essentially, it allows it to breathe.",1,0,0,0,0,646
b,273,pmla.2016.131.3.686_nonotes.txt,"Among the predominantly Muslim population of Kalimantan, traditional Dayak culture also carries associations with heathenism and black magic—to the point that Dayaks who converted to Islam often changed their ethnic affiliation to Malay.",0,1,0,0,0,647
b,246,sr.55.4.02_nonotes.txt,"A form's history, as well as its mode of appearance, shapes what it is perceived to say.",0,1,0,0,0,648
b,204,ci.42.4.687203_nonotes.txt,"Such uncertainties saturated European and American public culture in the YEARs and YEARs, tingeing science, the arts, and theology.",0,1,0,0,0,649
b,288,asr.2016.81.5.1039_nonotes.txt,"Furthermore, differences in racial disparities across the two gender groups are evident in the size of the earnings gap as well as in its sources and in the pace of its convergence over time.",0,1,0,0,0,650
e,183,ahr.2016.121.2.492_nonotes.txt,Marzahn had its own “round table” where representatives of various political parties met.,1,0,0,0,0,651
b,216,ahr.2016.121.3.727_nonotes.txt,She eventually moved to Salamanca because she could not find a monastery in Madrid that would accept her.,1,0,0,0,0,652
b,222,nlh.47.2.631303_nonotes.txt,"Rather, Latour urges readers to see that the protocols for knowing nature and knowing ourselves are both bound up in a process of composition: elements of the world must be set up alongside elements of our thought, as it were, in a single line of type.",0,1,0,1,0,653
e,303,asr.2016.81.3.447_nonotes.txt,One possibility is to supplement policies that empower the working class with increasing investment in research and development and education to boost labor productivity.,1,0,0,0,0,654
b,333,asr.2016.81.5.900_nonotes.txt,But individuals do not have equal access to these opportunities.,1,0,0,0,0,655
e,273,asr.2016.81.1.134_nonotes.txt,What are the implications for studying workers’ mental health and for devising organizational policies and practices to reduce risk factors?,1,0,0,0,0,656
b,366,asr.2016.81.1.165_nonotes.txt,"Harsh as it was, life aboard ships ordinarily met seamen’s expectations as determined by settled customs and predictable levels of reward and punishment.",0,1,0,0,0,657
b,210,ci.43.1.688306_nonotes.txt,"What makes Adele’s song seem, paradoxically, so appropriate to these settings, so much at home in them?",1,0,0,0,0,658
e,282,nlh.47.2.631305_nonotes.txt,Universities need to stand tall by emphasizing the duties that they fulfil.,1,0,0,0,0,659
e,108,ahr.2016.121.3.780_nonotes.txt,Fichte’s concept of the “closed commercial state” (Der geschlossene Handelsstaat) is a tempting antidote to the insidious consequences of the integrating forces.,0,1,0,0,0,660
b,321,asr.2016.81.4.800_nonotes.txt,"Not only does Moroccan and Turkish minorities’ Muslim background contrast with the predominantly Christian background of Dutch natives, but religion is in general much more important for Moroccans and Turks than for the highly secular native majority.",0,1,0,0,0,661
b,261,pmla.2016.131.1.101_nonotes.txt,"Finally, I will return to the question of Bertha's room and suggest how the novel's own symbolic architecture might help us address the question of this puzzlingly entrenched reading mistake.",1,0,0,0,0,662
b,216,sr.55.1.02_nonotes.txt,"""Intellectual Beauty,"" then, is not simply one phrase among others when it enters the economy of Shelley's poem.",0,1,0,0,0,663
b,294,asr.2016.81.5.877_nonotes.txt,"We then draw on an in-depth, qualitative case study of a cohesive town with a serious adolescent suicide problem, including a history of repeated or “echo” suicide clusters, to demonstrate how this reconceptualization of integration and regulation can improve our understanding of suicide in ways that are particularly meaningful for suicide prevention.",0,1,0,0,0,664
b,252,asr.2016.81.6.1161_nonotes.txt,"One motivation for our inquiry comes from two articles that, taken together, present a puzzle.",1,0,0,0,0,665
e,270,ci.42.3.685601_nonotes.txt, The first research on cloning was initially designed to study the mechanisms of cellular differentiation.,1,0,0,0,0,666
b,213,sn.48.3.02_nonotes.txt,"Although not traumatic in itself, the experience of conjuring resembles, in Cathy Caruth’s phrase, the unclaimed experiences of trauma, and it is in Bleak House that Dickens explores the connection between these discourses.",0,1,0,0,0,667
e,258,asr.2016.81.2.290_nonotes.txt,"The incapacitation/deterrence model, on the other hand, suggests reductions in racial/ethnic homicide disparities due to decreasing violence among minorities ensnared by the prison boom.",0,1,0,0,0,668
e,261,nlh.47.2.631298_nonotes.txt,"Latour’s mode of [ATT], much like Badiou’s conception of fidelity—though without Badiou’s Maoist dogmatism—is well suited to restore passion and commitment to the humanities.",0,1,1,0,0,669
e,219,sn.48.4.01_nonotes.txt,"Where “Penelope” ends with Molly Bloom falling asleep, Finnegans Wake (probably) takes place entirely in the sleeping mind of its protagonist, Humphrey Chimpden Earwicker.",1,0,0,0,0,670
b,249,asr.2016.81.6.1276_nonotes.txt,"Although likely influenced by the characteristics of their origin neighborhoods, upon separating from one’s parental family and establishing one’s own household, initial neighborhoods of residence are likely to be relatively low in socioeconomic status (SES), commensurate with the low earnings and unstable employment that typify initial entry into the workforce.",0,1,0,0,0,671
b,261,nlh.47.2.631298_nonotes.txt,"To say that war might one day be abolished sounds like a progressive claim, while saying that handguns in the possession of the citizenry will naturally increase violence also sounds like a progressive claim, even though “nature” is usually a conservative trope.",0,1,0,0,0,672
e,177,modernismmodernity.2016.23.4.833_nonotes.txt,"To instead attempt to view this as a ""universal"" vision of utopia ""fulfilled,"" even a utopia that contains the trace of death, or that resembles death, risks turning ""Sur l'Eau"" into just another ""pale and powerless"" vision, minimal consolation for a damaged life, rather than the grand ""magic trick"" that it is: a ready-made double dialectical image artfully re-composed, transformed, into a double image that both negates ""utopia"" and finds a call to utopian action in negation.",0,1,1,0,0,673
b,312,ahr.2016.121.2.377_nonotes.txt,"We looked for information in books we knew would have it, or in newspapers we knew would have it, or in archives we knew would have it.",1,0,0,0,0,674
e,174,modernismmodernity.2016.23.4.711_nonotes.txt,"Dalloway, a principle for marking life's private sphere and projecting faith, second-hand, across these privacies; without ongoing ideological work and juridical enforcement, Woolf tells us, these demarcations dissolve .",0,1,0,1,0,675
e,288,asr.2016.81.5.857_nonotes.txt,"The effect of this trend on crime reduction has been underwhelming, and some policies and practices have brought about opposite-than-intended effects by making crime worse.",0,1,0,0,0,676
e,246,asr.2016.81.3.575_nonotes.txt,These findings show that child protection intervention is most frequent in states with punitive social policy regimes and suppressed in states with social policy regimes that favor redistributive interventions.,0,1,0,0,0,677
b,318,asr.2016.81.2.215_nonotes.txt,What does it mean to span a cultural boundary?,1,0,0,0,0,678
e,180,nlh.47.4.643669_nonotes.txt,Not that we would have to advocate their exact ideas about the aesthetic—but we would likely need some notion of the specificity of art as a way of thinking or understanding if a practice like close reading is to be used a means of producing evidence.,0,1,0,0,0,680
e,180,modernismmodernity.2016.23.3.631_nonotes.txt,"As far back at least as Macbeth's ""Weird Sisters,"" the weird also implies something unearthly.",0,1,0,0,0,681
e,255,nlh.47.4.643670_nonotes.txt,"The catalog here pits the leveling effects of parataxis—the formal equivalent of automatization—against the escalating affective logic of Shklovsky’s own train of thought, which, undermining the apparent randomness of the list, moves from the material to the abstract, and from the emotionally neutral (clothes, furniture) to the affectively charged (wives, fear of war).",0,1,0,0,0,682
e,240,pmla.2016.131.5.1316_nonotes.txt,"In fact, strictly speaking it is not even written in English to begin with.",1,0,0,0,0,683
b,219,ci.42.2.684357_nonotes.txt,"Healthy and sick animals alike were bought and sold: the former in the market, the latter in the dark corners or cellars of Cow-Cross Street, Cock Lane, Hosier Lane, Sharp’s Alley, and elsewhere along the market perimeter.",1,0,0,0,0,684
b,189,ci.42.2.684354_nonotes.txt,"Hammershøi’s figures, when they appear, often face away from the viewer, as if absorbed in something that the viewer cannot share, but sometimes he depicts them in profile or front-facing, and on the rare occasions when he paints multi-figure compositions, the figures are distinguished from each other primarily by their relative position vis-à-vis the viewer.",1,0,0,0,0,685
e,195,sr.55.1.04_nonotes.txt,"Building on the earlier distrust of ""romance revivalism,"" the hollow affixing of residual color to the present reveals itself as a devastating miscalculation, one that can only exacerbate an already lopsided ideological landscape.",0,1,1,0,0,686
b,261,nlh.47.2.631298_nonotes.txt,Which baboon is now grooming or sharing food with another?,1,0,0,0,0,687
e,108,ahr.2016.121.3.780_nonotes.txt,This paradoxical institution thus forces us to rethink our standard histories of the nineteenth and twentieth centuries and sheds light on the institutions in which many of us make our home.,0,1,0,0,0,688
e,213,modernismmodernity.2016.23.3.611_nonotes.txt,"Without its world, the human is merely another species on earth, testing itself against threats of its own creation and in the process becoming a force like nature (capable only of overt behavior) that jeopardizes its own existence.",0,1,0,0,0,689
e,270,asr.2016.81.5.981_nonotes.txt,"Thus, when explicit information on legal status is not available, the stigma captured in the experiment is likely being applied to all Latinos, and particularly Mexican Americans.",0,1,0,0,0,690
e,282,sn.48.2.04_nonotes.txt,"This relation can only be specified critically at the moment style defamiliarizes habitual modes of comprehension, and thus appears as form.",0,1,0,0,0,691
e,186,sr.55.2.02_nonotes.txt,"Situating the ""Preface"" within a historically grounded discourse of enthusiasm, Mee locates the disjunction between poetry and passion primarily in the figure of the poet: the author must suppress his own enthusiasm in order to produce good poetry.",0,1,0,1,0,692
e,132,modernismmodernity.2016.23.4.855_nonotes.txt,"Third, far from representing a soldier as vindicating the culture's superiority by his rightful victory over his opponent, such poems dissolve any notion of one nation's higher claim to honor, freedom, justice, righteousness, and poetry by showing the opposing soldiers to be, in Service's words, ""just the same.""",0,1,0,0,0,693
e,237,pmla.2016.131.1.64_nonotes.txt,"The list poetic, representative and effacing, the list that doubles back on time, perhaps provides the best representation of itself as process, of its own future, as well as that of the multiple populations in time and space into whose lives it provides a brief and perpetually unsatisfying glimpse: Teâno wonck nippée am | I will be here by and by againe.",0,1,1,0,0,694
e,189,nlh.47.4.643673_nonotes.txt,It is this which makes Currie’s model of narrative so apt to the study of the one-day novel.,0,1,1,0,0,695
b,270,nlh.47.4.643674_nonotes.txt,"He possesses five senses for perceiving and a mind for modeling the world; he experiences hopes, doubts, fears, urges; he remembers triumphs, disappointments, faces, tunes, phrases.",1,0,0,0,0,696
e,183,sn.48.1.04_nonotes.txt,"She even demands physical removal from the ostentatious house that so repulses her, moving the Benedicts’ day-to-day domestic life to the more reasonably luxurious guest house and leaving the mansion to loom nearby like a mausoleum of past Benedict capitalists.",1,0,0,0,0,697
e,249,pmla.2016.131.5.1207_nonotes.txt,"It may not be necessary because translation becomes the endemic state of communication, of language itself.",0,1,0,0,0,698
e,369,nlh.47.4.643672_nonotes.txt,Perhaps there’s a literary parallel to the theatrical commonplace that real acting can’t happen “on book.”,1,0,0,0,0,701
b,261,pmla.2016.131.3.622_nonotes.txt,"Young men from the very earliest days of the East India Company joined the enterprise at its lowest rank, writer, working in factories to further the aims of colonial commerce.",1,0,0,0,0,702
