section,sent.no,filename,sentences,neutral,generalization,exemplification,attribution,conditional,ID
b,219,modernismmodernity.2016.23.1.113_nonotes.txt,"While some of that pressure could be felt in the very trappings of the office in which they sat, I argue that the poets who filled this postwar laureateship were most acutely made aware of the limits of its power in their interactions with their institutionalized double in St.",0,1,0,0,0,2770
e,234,pmla.2016.131.5.1328_nonotes.txt,"The history of capitalism is a series of cycles that repeat themselves over time and operate according to Marx's formula MCM (where M = money, C = the transformation of money into commodities, and M = the return to money form that follows from the liquidation of commodities).",0,1,0,0,0,2771
b,168,nlh.47.1.626117_nonotes.txt,"Implicit in the critical works I want to discuss is the irrelevance of actual women artists—directors, screenwriters, cinematographers, and all the other workers who contribute to the making of a film.",0,1,0,0,0,2772
e,357,pmla.2016.131.1.20_nonotes.txt,"In the light of the deep metaphoric referents in the images from YEAR and YEAR, Okeke's mid-century illustrations appear even more startling and destabilizing, and Achebe's flat style seems all the more revolutionary.",1,0,0,0,0,2774
e,219,modernismmodernity.2016.23.1.113_nonotes.txt,"And, in that sense, the ""soldier home from the war"" is Bishop, too.",1,0,0,0,0,2775
b,273,modernismmodernity.2016.23.1.219_nonotes.txt,Babies and growing children meant extra coupons.,1,0,0,0,0,2776
e,288,asr.2016.81.5.857_nonotes.txt,Individual instances of institutional failure can have aggregate and lasting consequences that vitiate police-community relations and thwart crime-reduction efforts.,0,1,0,0,0,2777
b,225,sn.48.2.05_nonotes.txt,"In many ways, Bambara’s novelistic exploration of testimonial action resonates with theories of testimony as a response to historical trauma.",0,1,0,0,0,2778
e,210,sr.55.1.03_nonotes.txt,"In this way, Wallenstein declares that the problem of people's inability to seek or to desire legitimate change in their way of living, or even simply to latch onto and earnestly support a leader who would do so, grows from their own construction of themselves from that which is already in existence, already available, or already familiar.",0,1,0,1,0,2780
b,336,asr.2016.81.2.347_nonotes.txt,"Oliver (YEAR) further suggested that decoupling can serve the political interests of powerful insiders, allowing them to strategically manage external demands without limiting their autonomy.",0,1,0,1,0,2782
b,219,ci.42.2.684359_nonotes.txt,"In several Williams poems, at any rate, the poet’s eye turns out to be a kind of surreptitious palpating machine.",0,1,0,0,0,2783
b,183,ahr.2016.121.2.492_nonotes.txt,"The goal of that transformation, however, was the creation of a new kind of community.",0,1,0,0,0,2784
b,198,ahr.2016.121.1.70_nonotes.txt,"Ultimately, Sörgel’s plans failed to materialize.",1,0,0,0,0,2785
b,216,ahr.2016.121.3.727_nonotes.txt,An excellent example of this process can be found in the early seventeenth century.,1,0,0,0,0,2786
e,216,modernismmodernity.2016.23.4.771_nonotes.txt,"Rather, Conrad has a more nuanced, duplicitous, and ultimately hypermimetic diagnostic in mind: namely, that ""plasticity"" is both the medium of his artistic formation and of his character's transformation, part  of a spiraling process that is both active and passive, natural and cultural, fictive and real, pathological and patho-logical, and-supplementing a purely linguistic principle- leaves immanent, material, physio-psychological impressions behind.",0,1,0,0,0,2787
b,189,modernismmodernity.2016.23.2.423_nonotes.txt,This idea of therapeutic sunbathing had a broad emotional appeal.,0,1,0,0,0,2788
b,141,modernismmodernity.2016.23.3.573_nonotes.txt,"This response exposes the constitutively pathogenic condition of observation, understood in the terms of the German systems theorist Niklas Luhmann: the persistent presupposition of art's autonomous representation of experience or embodiment of truth in the face of its historical failure in late modern capitalist society.",0,1,0,0,0,2790
e,195,sr.55.1.04_nonotes.txt,"As James enlists Highland troops to fight Napoleon en route to the ""just"" inheritance of the Kittlestonheugh estates, Galt may well be laughing in the face of such mythic ideological processes .",1,0,0,0,0,2791
e,192,sn.48.2.01_nonotes.txt,"The ironic, self-reflexive voice of metafiction is also clearly a reaction against the poetics of impersonality championed by Ford Madox Ford and articulated by critics such as Lubbock and Beach.",0,1,0,0,0,2792
b,303,asr.2016.81.1.85_nonotes.txt,"These cultural markers are then perceived by friends, family, teachers, and others, including potential employers.",1,0,0,0,0,2793
e,258,nlh.47.1.626112_nonotes.txt,Nixon kicks off Slow Violence and the Environmentalism of the Poor with an epigraph citing Lawrence Summers’s comments; Gilroy also alludes to them in Postcolonial Melancholia.,1,0,0,0,0,2794
b,246,asr.2016.81.2.242_nonotes.txt,"In this article, we analyze the impact of migration on native Germans’ support for welfare.",1,0,0,0,0,2795
e,162,ahr.2016.121.2.461_nonotes.txt,"My own rediscovery of Mallery’s work greatly enhanced my ability to find and interpret Indian signs in colonial sources, unveiled a complex set of historiographical entanglements and interdisciplinary boundaries, and prompted some preliminary conclusions that are possible only at the intersection of several disciplines, time periods, and regions of the world.",1,0,0,0,0,2796
e,270,ci.42.3.685601_nonotes.txt,Biological potentials reveal unprecedented modes of transformation: reprogramming genomes without modifying the genetic program; replacing all or part of the body without a transplant or prosthesis; a conception of the self as a source of reproduction.,1,0,0,0,0,2797
b,300,pmla.2016.131.5.1256_nonotes.txt,"She also found a way to write outside, and against, what she saw as the reductive terms of wartime and postwar debate.",1,0,0,0,0,2798
e,189,ci.42.2.684354_nonotes.txt,"Furthermore, the paintings’ selective focus—with some areas precisely detailed and other areas abstracted or effaced—and their combination of bold geometric composition and delicate, varied facture create a push-and-pull between overall formal design and close observational detail that corresponds to the temporal dilation of their motifs.",1,0,0,0,0,2799
e,249,ci.43.1.688293_nonotes.txt,"Chamayou sees this shift as a cynical tactic by the US military to claim that drone pilots suffer also, but this interpretation fails to do justice to Brandon’s feeling that he has been through a “soul-crushing experience.”",1,0,0,0,0,2800
b,234,pmla.2016.131.1.38_nonotes.txt,"When he gave readings, he chatted about poetry, art, and politics, passing down an anecdotal, pedagogical reading style exemplified now by popular poets such as Billy Collins.",1,0,0,0,0,2801
b,132,modernismmodernity.2016.23.4.855_nonotes.txt,"Illuminating the felt or experiential basis for some of the more abstract forms of cosmopolitanism, they demonstrate that war can be, paradoxically, a catalyst for meaningful cross-cultural encounters and reflections.",0,1,0,0,0,2802
b,333,asr.2016.81.5.900_nonotes.txt,Couples might then respond to these structural factors in their location choices.,0,1,0,0,1,2803
b,210,modernismmodernity.2016.23.2.297_nonotes.txt,"They simplify Seven Pillars's indeterminacy, its play with literary conventions and versions of truth.",0,1,0,0,0,2804
b,174,modernismmodernity.2016.23.2.341_nonotes.txt,"The master villain's mode of operation, informed by the dynamics of spread, may well count as the most significant feature of his success story.",1,0,0,0,0,2805
e,255,sn.48.4.05_nonotes.txt,"Through language, this literature resets national borders and mythologies, creating a new cultural geography through a multiplicity of stories and self-definitions.",0,1,0,0,0,2806
e,288,asr.2016.81.1.107_nonotes.txt,"Potential bias is always possible when using retrospective questions, but the MIDUS questionnaire was devised to minimize bias by asking for specific information on experiences and never mentioning words such as adversity or abuse.",1,0,0,0,0,2808
b,249,ahr.2016.121.1.39_nonotes.txt,"The day before the rebellion started, Helvetia’s overseer, Johannes Meijer, accused her and another woman, an Amerindian whose name was not recorded, of trying to poison him with a dish of bad liver.",1,0,0,0,0,2809
b,369,nlh.47.4.643672_nonotes.txt,"Singers, when they talk shop, don’t just stick to questions of musicality or style; they discuss their vocal production and the stout column of breath that sustains it.",0,1,0,0,0,2811
b,270,ci.42.3.685601_nonotes.txt,"Paradoxically, they expel the biological that is supposed to constitute their core—and it thereby becomes their unthinkable residue.",0,1,0,0,0,2812
e,291,nlh.47.2.631306_nonotes.txt,These readings do not cancel each other out.,1,0,0,0,0,2813
b,249,asr.2016.81.6.1276_nonotes.txt,"However, prior studies in this area have been quite limited in the length of time they are able to follow individuals through their “neighborhood life course.”",1,0,0,0,0,2814
e,162,nlh.47.1.626115_nonotes.txt,"Those conventions and assumptions derive not from the Constitution itself but from a field of “interpretive pre-understanding”—what Hans-Georg Gadamer calls Vorurteil, pre-judgement or “prejudice”—that governs the rules of legal disputation.",0,1,0,0,0,2815
b,222,nlh.47.2.631303_nonotes.txt,"The computational analysis of texts finds its origins in traditional philological practices—indexing, concordance making, enumeration of forms, and the like.",0,1,0,0,0,2816
e,285,ci.43.1.688305_nonotes.txt,"Like the ancestors of the Shang and Zhou royal houses, he transcended the possibility of visual representation.",1,0,0,0,0,2817
b,207,ci.42.2.684358_nonotes.txt,"Instead of making games into diegetically homogenous three-dimensional worlds, as VR devices like the Oculus Rift promise to do, philosophical skepticism, like ARGs, makes the world into a game.",0,1,0,0,0,2818
b,159,ci.42.4.686959_nonotes.txt,"By modeling activity that was mutable, collaborative, participatory, and open to contingency, these writers and artists provided a formative vocabulary for the mounting dissatisfaction with the qualitative character of labor, shaping the way in which workers would articulate their unhappiness as well as the way that this unhappiness was understood by corporate management and the political class.",0,1,0,0,0,2819
e,198,ahr.2016.121.4.1141_nonotes.txt,"That this system of taxation and state expenditure, defined by a massive upward shift in wealth, gained steam in the last third of the nineteenth century, during the first great depression, should give us pause.",0,1,0,0,0,2820
b,201,nlh.47.2.631301_nonotes.txt,"While most of us envisaged action as performed and authored by a human subject (occasionally helped by various forms of instruments and assistants), his work taught us to attribute the efficiency of human actions to complex networks assembling heterogeneous bits of physical stuff, institutional leverage, symbolic tools, energy sources, intellectual credit, and financial montage.",0,1,0,1,0,2821
b,264,modernismmodernity.2016.23.2.365_nonotes.txt,"It is precisely the novel's sculptural and erectile imperatives, however, that betray its vast literary patrimony.",0,1,0,0,0,2822
b,285,asr.2016.81.6.1132_nonotes.txt,Stereotypes of gay and bisexual men decidedly do not fit this prototype.,1,0,0,0,0,2823
b,303,asr.2016.81.1.85_nonotes.txt,"Such audit studies, of course, are unable to shed light on historical patterns of discrimination.",0,1,0,0,0,2824
b,312,ahr.2016.121.2.377_nonotes.txt,"In contrast, the digitized turn is one that all historians, however traditional, are enacting, and about which the great majority of us have had nothing to say.",0,1,0,0,0,2825
b,180,ahr.2016.121.1.17_nonotes.txt,"Tasman’s instructions stipulated that he could take possession of populated lands by means of three equally straightforward methods: inducing local people to hand over “a small tree planted in a little earth,” setting up a stone in their territory, or simply erecting a flag.",1,0,0,0,0,2826
e,243,asr.2016.81.4.720_nonotes.txt,"However, the mass automation of non-routine manual tasks has led to an even greater polarization of higher- and lower-skill jobs for women than for men, with most well-paying sub-baccalaureate jobs today concentrated within male-dominated, blue-collar fields.",0,1,0,0,0,2827
e,309,asr.2016.81.1.57_nonotes.txt,"However, does it make a difference whether people call themselves white, minority, or multiracial?",1,0,0,0,0,2829
b,306,asr.2016.81.5.1014_nonotes.txt,"I argue that neoliberal domination manifests as exclusion, or widespread un- and underemployment; I contrast this to a prior era of capitalism, when black men were most frequently exploited—devalued and underpaid—laborers.",0,1,0,0,0,2830
b,237,sr.55.3.02_nonotes.txt,"The two had made a deal: on arrival at the coast, Park would pay Karfa ""the value of one prime slave.""",1,0,0,0,0,2831
b,225,sn.48.2.05_nonotes.txt,"Yet novels are suited for this purpose because they can explore testimonial action as narrative construction, in Bambara’s book with special attention to the operations of silence and the limits of standing for others, without restricting the investigation’s outcome to an assessment of truth.",0,1,0,0,0,2832
b,366,asr.2016.81.1.165_nonotes.txt,"Incumbents confined to subordinate positions in a social structure tend to tolerate grievances like poor wages, difficult working conditions, and political exclusion so long as they remain at routine and predictable levels.",0,1,0,0,0,2833
b,294,asr.2016.81.5.877_nonotes.txt,"This likely results from sociology’s failure to settle on a clear, widely accepted definition for regulation.",0,1,0,0,1,2834
e,252,asr.2016.81.6.1161_nonotes.txt,"Black women have lower wages than white women, but they have lower total penalties for motherhood.",0,1,0,0,0,2835
e,294,asr.2016.81.5.877_nonotes.txt,"If the dangers of integration and regulation discussed in this study are in fact a partial product of racial or socioeconomic homogeneity, then this study contributes to arguments that posit diversity as a positive public good: diverse societies may have more alternative cultural scripts from which community members may choose.",0,1,0,0,1,2836
b,108,ahr.2016.121.3.780_nonotes.txt,"Rather than purely supportive, as Hadley idealized, or fiercely cutthroat, as Wagner feared, knowledge exchange resulted in relationships that were both competitive and cooperative.",0,1,0,0,0,2837
b,282,sn.48.2.04_nonotes.txt,Two broad responses might be discerned in respect to this particular aspect of Sebald’s writing.,1,0,0,0,0,2838
b,261,pmla.2016.131.1.101_nonotes.txt,For Jane Eyre—and Jane Eyre—are quite clear that Bertha's cheerless room is on the third story of Rochester's ancestral home.,1,0,0,0,0,2839
b,168,sr.55.2.03_nonotes.txt,"Critics like Katie Trumpener and Ina Ferris have shown that the nationalist historical novel was the dominant fictional subgenre in Scotland and Ireland specifically, and the so-called Celtic periphery of Britain more generally, during the late eighteenth and early nineteenth centuries.",0,1,0,1,0,2840
b,126,ci.42.3.685603_nonotes.txt,"Aided by developments in mechanized calculation, the secular oracles of a future American century, most notably in organizations such as Princeton’s Institute for Advanced Study, the RAND Corporation, and national laboratories at Oak Ridge and Los Alamos (as well as, of course, the Manhattan Project before them), began positing questions about the future during the mid-YEARs that would have not only been unanswerable a generation before (climate modeling, nuclear war games, election forecasts) but also unaskable—shelved as irrelevant because ostensibly incalculable.",0,1,0,0,0,2841
b,222,sn.48.3.06_nonotes.txt,"Katsma fails to consider, in other words, that the growing stillness of human characters might be related to the increasing loudness of urban noise.",0,1,0,0,1,2842
e,222,nlh.47.2.631303_nonotes.txt,"I invite you now, knowing what you know of Othello and Snyder’s insights, to engage in the following thought experiment.",1,0,0,0,0,2845
e,270,asr.2016.81.5.981_nonotes.txt,"Thus, even scholars who are mainly concerned with structural assimilation and decreasing inequality risk missing the vulnerability of minorities’ social mobility gains if they do not examine the intangible, symbolic dimension of assimilation identified here.",1,0,0,0,0,2846
b,321,asr.2016.81.4.800_nonotes.txt,"Moreover, joining and leaving are fundamentally distinct processes.",1,0,0,0,0,2847
b,204,nlh.47.2.631300_nonotes.txt,"It’s a bit suspect to claim radicalism for oneself, but, as it happens, this is part of the history of ANT, which burst onto a very diversified field with a polemical tone.",1,0,0,0,0,2848
e,219,nlh.47.2.631297_nonotes.txt,"And it can be a political act to the extent that allies have been gained or lost, depending on the outcome of the experiment.",1,0,0,0,0,2849
e,162,ahr.2016.121.2.461_nonotes.txt,"Early instances of European manually coded languages for the deaf, as well as other expressions of Western kinetic traditions in the realm of oratory and drama, in particular, are typically omitted from studies of cross-cultural communication in early America.",0,1,0,0,0,2850
e,219,ci.42.3.685606_nonotes.txt,"Granted, there are places in Europe, especially in small towns and rural areas, where one can still observe these customs.",1,0,0,0,0,2852
b,126,ci.42.3.685603_nonotes.txt,"Or, even more urgently, what are we to make of the fact that a quasi-religious regime of World Futures has come to dominate the business landscape at precisely the moment when it has become clear that our planet—and its rapidly changing climate—is headed toward a singularly and catastrophically fiery future?",0,1,0,0,0,2853
e,303,asr.2016.81.2.262_nonotes.txt,"Gender differences in the effects of part-time work (and, to some extent, unemployment) also contribute to sociological theories of the “ideal worker.”",0,1,0,0,0,2854
b,219,nlh.47.2.631304_nonotes.txt,"This moral demand on humans today acquires an additional twist from the thought that, seen in a long-term perspective, unabated global warming may very well accelerate the already growing rates of human-induced extinction of nonhuman species, with unhappy consequences for humans themselves.",0,1,0,0,1,2855
b,354,asr.2016.81.4.617_nonotes.txt,Opportunism is behavior that deliberately disappoints a transaction partner’s expectations.,1,0,0,0,0,2856
e,189,sr.55.3.04_nonotes.txt,Yet Hogg also modernizes the Nights in a renewed effort to liken his dynamics of storytelling to the early nineteenthcentury literary marketplace.,0,1,0,0,0,2857
e,240,ci.42.2.683453_nonotes.txt,"As cultural historians, we would have difficulty positioning the poem within the known circuits of dissemination as plotted by modernist scholars, not least because of Porter’s anonymity.",0,1,0,0,0,2858
b,198,sn.48.2.03_nonotes.txt,"Given that Ask the Dust is widely read as a roman-à-clef  —and with good reason given the biographical correspondences between Bandini and Fante, on which Fante himself is known to have commented—we might feel some temptation to assume that Ask the Dust positions Bandini in the role of hero.",1,0,0,0,0,2859
b,252,asr.2016.81.6.1161_nonotes.txt,"After arguing for the appropriateness of UQR to answer Budig and Hodges’s (YEAR) question, Killewald and Bearak (YEAR) re-estimate Budig and Hodges’s (YEAR) simplest baseline model, and they find little difference in motherhood penalties by quantile; this contrasts with Budig and Hodges’s CQR findings of higher penalties for lower-wage women.",0,1,0,1,0,2860
b,303,asr.2016.81.2.262_nonotes.txt,Understanding the consequences of nonstandard and mismatched employment for workers’ hiring outcomes is therefore necessary for a more comprehensive account of labor market stratification in the current economic landscape.,0,1,0,0,0,2861
b,270,ci.42.3.685601_nonotes.txt,"It seems inconceivable that biologists do not know Foucault, that they have never encountered the word biopolitical.",0,1,0,0,0,2862
e,234,nlh.47.4.643671_nonotes.txt,These mediations are not some sort of supplement to the object of taste (the New Look); they are an intricate part of that world of taste.,0,1,0,0,0,2863
b,192,sr.55.4.04_nonotes.txt,His responsibilities and experiences as Sheriff Depute of Selkirkshire required that he be familiar with the state of the law surrounding mental health.,1,0,0,0,0,2864
b,216,modernismmodernity.2016.23.4.771_nonotes.txt,"I suggest that the neurosciences paradoxically confirm a point theorists in the humanities have been making all along: they emphasize the dominant role played by culture, history, and language-not nature-in the formation, deformation, and transformation of subjectivity.",0,1,0,1,0,2865
b,219,modernismmodernity.2016.23.2.319_nonotes.txt,"I draw from many of the questions Harding considers, but looking at Mahfouz's novel, I consider representation differently-as not simply a matter of representing modernists or traditionalists, but of considering how representation is inseparable from the world certain representational regimes make knowable.",0,1,0,0,0,2866
b,198,ahr.2016.121.4.1141_nonotes.txt,"And just as this period provided previously unmatched resources for state intervention and a redefinition of the state-society relationship, it also inaugurated a new era of public debt: “The war of YEAR–YEAR marked a momentous rupture,” argues Jean-Yves Grenier, “for it led to the massive intervention of the state in the economic realm and a considerable increase in public debt.”",0,1,0,1,0,2867
e,252,asr.2016.81.6.1161_nonotes.txt,"Overall, our analysis shows that privilege (on race, wage, or skill) has its price—larger proportionate motherhood penalties.",0,1,0,0,0,2868
e,234,pmla.2016.131.5.1328_nonotes.txt,"Against the ""disinterested"" universalism of liberal historiography he discovers the ""interested . . . cosmopolitanism"" of abolitionist discourse.",1,0,0,0,0,2870
b,312,ahr.2016.121.2.377_nonotes.txt,"For historians, borders are not what they used to be.",0,1,0,0,0,2871
b,201,pmla.2016.131.3.668_nonotes.txt,"Arnold himself would be hailed as a hero on visiting Ceylon in YEAR; stopping by Vidyodaya College, a center of the revival, he would be told by the monk Weligama Sri Sumangala ""that 'The Light of Asia' was constantly read in the Sangha, and that arrangements were being made to translate it into Pali and Sin[h]alese,"" the sacred and secular languages of Ceylonese Buddhism.",1,0,0,0,0,2872
e,219,pmla.2016.131.3.636_nonotes.txt,"As she crosses the threshold between the body and the machine, her paralysis jams the diction of the passage into a stultified series of fragments separated by commas from ""Ellen felt herself sitting"" to ""was turning to glass.""",1,0,0,0,0,2873
e,183,ahr.2016.121.2.492_nonotes.txt,"This historiography largely assumes that the model of consumption that transfixed citizens on both sides of the Iron Curtain was the postwar American model, anchored by the single-family suburban home, which “seemed to promise a surefire way of incorporating a wide range of Americans into a mass consumption–based middle class.”",0,1,0,0,0,2874
b,363,asr.2016.81.3.421_nonotes.txt,"Indeed, over the past three decades, federal tax policy has shifted away from taxation of the elite, reducing tax rates on top incomes, capital gains, and multi-million dollar inheritances—a process to “untax the one percent”.",0,1,0,0,0,2875
e,288,asr.2016.81.4.644_nonotes.txt,Parents and guardians rely on kin to provide childcare to minimize costs and anxieties.,0,1,0,0,0,2876
e,195,sr.55.1.04_nonotes.txt,"Far from cleanly resolving itself, the disparate experiences of the text have established the terms of an ideological incongruity that is undermining the nation, rendering an unattractive ethical flexibility crucial to its navigation.",0,1,0,0,0,2877
e,186,sr.55.2.02_nonotes.txt,Why bring up spontaneity and powerful feelings only to contradict them moments later by privileging tranquility and contemplation?,1,0,0,0,0,2878
b,300,pmla.2016.131.5.1256_nonotes.txt,"It also requires us to revisit the ways in which translation counted, for wartime writers and readers, as a political act.",0,1,0,0,0,2879
e,183,pmla.2016.131.2.324_nonotes.txt,"In the vibrant debate over reading, critics have largely invoked the language of space rather than time.",0,1,0,0,0,2880
b,261,asr.2016.81.2.374_nonotes.txt,"In contrast, collective action experiences that highlight what businesses can do independently of their community may make them less likely to care about community well-being; in the post-collective action period, they may thus be more likely to propose eliminating small market players.",0,1,0,0,1,2881
b,303,asr.2016.81.2.262_nonotes.txt,"This article focuses on three employment situations—part-time work, temporary agency employment, and skills underutilization—falling into two overarching employment categories: nonstandard work and mismatched work.",1,0,0,0,0,2882
b,246,asr.2016.81.3.575_nonotes.txt,"They do so by enforcing prohibitions against legally codified unacceptable parenting behavior, establishing a system for the surveillance of child maltreatment, providing a formal process through which violations can be investigated and classified, and intervening in a manner that both sanctions parents and protects children.",1,0,0,0,0,2883
